Niche,Topic,Template,Hook,Caption,Description,CTA,Full Post
business,Marketing on a budget,motivational,How I built a 7-figure business from scratch,"How I built a 7-figure business from scratch

Here's why Marketing on a budget matters.

Your take?","In this post, we explore marketing on a budget. Let me know if you've tried this before.",Tag a friend who needs this,"💪 MOTIVATION MONDAY 💪 |  | How I built a 7-figure business from scratch |  | How I built a 7-figure business from scratch |  | Here's why Marketing on a budget matters. |  | Your take? |  | In this post, we explore marketing on a budget. Let me know if you've tried this before. |  | Tag a friend who needs this |  | #Motivation #Business #Inspiration"
business,Building a business with no money,controversial,Why most businesses fail in the first year,"Why most businesses fail in the first year

Here's why Building a business with no money matters.

Your take?","In this post, we explore building a business with no money. What are your thoughts on this approach?",Comment below what you think!,"⚡ CONTROVERSIAL OPINION ⚡ |  | Why most businesses fail in the first year |  | Why most businesses fail in the first year |  | Here's why Building a business with no money matters. |  | Your take? |  | In this post, we explore building a business with no money. What are your thoughts on this approach? |  | Comment below what you think! |  | #Controversial #Business #Debate"
business,Managing cash flow,ranking,The marketing strategy that exploded my growth,"The marketing strategy that exploded my growth

Managing cash flow

What do you think?",Here's what you need to know about managing cash flow. Share your experiences in the comments!,What's your take? Reply below,📊 TOP 5: MANAGING CASH FLOW |  | The marketing strategy that exploded my growth |  | The marketing strategy that exploded my growth |  | Managing cash flow |  | What do you think? |  | Here's what you need to know about managing cash flow. Share your experiences in the comments! |  | What's your take? Reply below |  | #Ranking #Business #Top5
business,Building brand authority,controversial,How I built a 7-figure business from scratch,"The truth about Building brand authority:

How I built a 7-figure business from scratch

Agree or disagree?",Let's dive into building brand authority. Share your experiences in the comments!,Comment below what you think!,⚡ CONTROVERSIAL OPINION ⚡ |  | How I built a 7-figure business from scratch |  | The truth about Building brand authority: |  | How I built a 7-figure business from scratch |  | Agree or disagree? |  | Let's dive into building brand authority. Share your experiences in the comments! |  | Comment below what you think! |  | #Controversial #Business #Debate
business,Customer retention strategies,motivational,How to scale without losing your soul,"How to scale without losing your soul

Customer retention strategies

What do you think?",Let's dive into customer retention strategies. How has this impacted your life?,Save this for later!,💪 MOTIVATION MONDAY 💪 |  | How to scale without losing your soul |  | How to scale without losing your soul |  | Customer retention strategies |  | What do you think? |  | Let's dive into customer retention strategies. How has this impacted your life? |  | Save this for later! |  | #Motivation #Business #Inspiration
business,Adapting to market changes,ranking,The pricing mistake that almost killed my business,"The truth about Adapting to market changes:

The pricing mistake that almost killed my business

Agree or disagree?",Breaking down the concept of adapting to market changes. Let me know if you've tried this before.,Tag a friend who needs this,📊 TOP 5: ADAPTING TO MARKET CHANGES |  | The pricing mistake that almost killed my business |  | The truth about Adapting to market changes: |  | The pricing mistake that almost killed my business |  | Agree or disagree? |  | Breaking down the concept of adapting to market changes. Let me know if you've tried this before. |  | Tag a friend who needs this |  | #Ranking #Business #Top5
business,Hiring the right team,business_lesson,How I built a 7-figure business from scratch,"How I built a 7-figure business from scratch

Here's why Hiring the right team matters.

Your take?",Breaking down the concept of hiring the right team. This could change how you think about it.,Comment below what you think!,📈 BUSINESS LESSON 📈 |  | How I built a 7-figure business from scratch |  | How I built a 7-figure business from scratch |  | Here's why Hiring the right team matters. |  | Your take? |  | Breaking down the concept of hiring the right team. This could change how you think about it. |  | Comment below what you think! |  | #Business #Business #Entrepreneurship
business,The importance of networking,business_lesson,The marketing strategy that exploded my growth,"The truth about The importance of networking:

The marketing strategy that exploded my growth

Agree or disagree?","In this post, we explore the importance of networking. How has this impacted your life?",Comment below what you think!,"📈 BUSINESS LESSON 📈 |  | The marketing strategy that exploded my growth |  | The truth about The importance of networking: |  | The marketing strategy that exploded my growth |  | Agree or disagree? |  | In this post, we explore the importance of networking. How has this impacted your life? |  | Comment below what you think! |  | #Business #Business #Entrepreneurship"
business,Pricing your products right,controversial,The pricing mistake that almost killed my business,"The pricing mistake that almost killed my business

Pricing your products right

What do you think?",Here's what you need to know about pricing your products right. What are your thoughts on this approach?,Drop a 🔥 if you agree,⚡ CONTROVERSIAL OPINION ⚡ |  | The pricing mistake that almost killed my business |  | The pricing mistake that almost killed my business |  | Pricing your products right |  | What do you think? |  | Here's what you need to know about pricing your products right. What are your thoughts on this approach? |  | Drop a 🔥 if you agree |  | #Controversial #Business #Debate
business,Scaling without losing quality,ranking,Why most businesses fail in the first year,"Why most businesses fail in the first year

Here's why Scaling without losing quality matters.

Your take?",Let's dive into scaling without losing quality. This could change how you think about it.,Comment below what you think!,📊 TOP 5: SCALING WITHOUT LOSING QUALITY |  | Why most businesses fail in the first year |  | Why most businesses fail in the first year |  | Here's why Scaling without losing quality matters. |  | Your take? |  | Let's dive into scaling without losing quality. This could change how you think about it. |  | Comment below what you think! |  | #Ranking #Business #Top5
